[I 2024-03-08 18:29:13,072] Trial 33 finished with value: 1.4996282527881055 and parameters: {'knn_metric': 'chebyshev', 'n_neighbors': 32, 'batch_size': 128}. Best is trial 12 with value: 1.6879801734820328.
/ghome/group07/anaconda3/envs/torch/lib/python3.10/site-packages/torchvision/models/_utils.py:223: UserWarning: Arguments other than a weight enum or `None` for 'weights' are deprecated since 0.13 and may be removed in the future. The current behavior is equivalent to passing `weights=ResNet18_Weights.IMAGENET1K_V1`. You can also use `weights=ResNet18_Weights.DEFAULT` to get the most up-to-date weights.
  warnings.warn(msg)
[I 2024-03-08 18:29:17,981] Trial 34 finished with value: 1.526641883519208 and parameters: {'knn_metric': 'euclidean', 'n_neighbors': 43, 'batch_size': 8}. Best is trial 12 with value: 1.6879801734820328.
/ghome/group07/anaconda3/envs/torch/lib/python3.10/site-packages/torchvision/models/_utils.py:223: UserWarning: Arguments other than a weight enum or `None` for 'weights' are deprecated since 0.13 and may be removed in the future. The current behavior is equivalent to passing `weights=ResNet18_Weights.IMAGENET1K_V1`. You can also use `weights=ResNet18_Weights.DEFAULT` to get the most up-to-date weights.
  warnings.warn(msg)
[I 2024-03-08 18:29:23,818] Trial 35 finished with value: 1.681288723667906 and parameters: {'knn_metric': 'euclidean', 'n_neighbors': 22, 'batch_size': 128}. Best is trial 12 with value: 1.6879801734820328.
/ghome/group07/anaconda3/envs/torch/lib/python3.10/site-packages/torchvision/models/_utils.py:223: UserWarning: Arguments other than a weight enum or `None` for 'weights' are deprecated since 0.13 and may be removed in the future. The current behavior is equivalent to passing `weights=ResNet18_Weights.IMAGENET1K_V1`. You can also use `weights=ResNet18_Weights.DEFAULT` to get the most up-to-date weights.
  warnings.warn(msg)
[I 2024-03-08 18:29:31,932] Trial 36 finished with value: 1.5323420074349448 and parameters: {'knn_metric': 'chebyshev', 'n_neighbors': 26, 'batch_size': 128}. Best is trial 12 with value: 1.6879801734820328.
/ghome/group07/anaconda3/envs/torch/lib/python3.10/site-packages/torchvision/models/_utils.py:223: UserWarning: Arguments other than a weight enum or `None` for 'weights' are deprecated since 0.13 and may be removed in the future. The current behavior is equivalent to passing `weights=ResNet18_Weights.IMAGENET1K_V1`. You can also use `weights=ResNet18_Weights.DEFAULT` to get the most up-to-date weights.
  warnings.warn(msg)
[I 2024-03-08 18:29:38,422] Trial 37 finished with value: 1.6215613382899634 and parameters: {'knn_metric': 'euclidean', 'n_neighbors': 18, 'batch_size': 16}. Best is trial 12 with value: 1.6879801734820328.
/ghome/group07/anaconda3/envs/torch/lib/python3.10/site-packages/torchvision/models/_utils.py:223: UserWarning: Arguments other than a weight enum or `None` for 'weights' are deprecated since 0.13 and may be removed in the future. The current behavior is equivalent to passing `weights=ResNet18_Weights.IMAGENET1K_V1`. You can also use `weights=ResNet18_Weights.DEFAULT` to get the most up-to-date weights.
  warnings.warn(msg)
[I 2024-03-08 18:29:51,288] Trial 38 finished with value: 1.5687732342007443 and parameters: {'knn_metric': 'euclidean', 'n_neighbors': 33, 'batch_size': 8}. Best is trial 12 with value: 1.6879801734820328.
/ghome/group07/anaconda3/envs/torch/lib/python3.10/site-packages/torchvision/models/_utils.py:223: UserWarning: Arguments other than a weight enum or `None` for 'weights' are deprecated since 0.13 and may be removed in the future. The current behavior is equivalent to passing `weights=ResNet18_Weights.IMAGENET1K_V1`. You can also use `weights=ResNet18_Weights.DEFAULT` to get the most up-to-date weights.
  warnings.warn(msg)
[I 2024-03-08 18:30:18,813] Trial 39 finished with value: 1.6835192069392808 and parameters: {'knn_metric': 'manhattan', 'n_neighbors': 41, 'batch_size': 128}. Best is trial 12 with value: 1.6879801734820328.
/ghome/group07/anaconda3/envs/torch/lib/python3.10/site-packages/torchvision/models/_utils.py:223: UserWarning: Arguments other than a weight enum or `None` for 'weights' are deprecated since 0.13 and may be removed in the future. The current behavior is equivalent to passing `weights=ResNet18_Weights.IMAGENET1K_V1`. You can also use `weights=ResNet18_Weights.DEFAULT` to get the most up-to-date weights.
  warnings.warn(msg)
[I 2024-03-08 18:30:28,998] Trial 40 finished with value: 1.4696406443618346 and parameters: {'knn_metric': 'chebyshev', 'n_neighbors': 37, 'batch_size': 32}. Best is trial 12 with value: 1.6879801734820328.
/ghome/group07/anaconda3/envs/torch/lib/python3.10/site-packages/torchvision/models/_utils.py:223: UserWarning: Arguments other than a weight enum or `None` for 'weights' are deprecated since 0.13 and may be removed in the future. The current behavior is equivalent to passing `weights=ResNet18_Weights.IMAGENET1K_V1`. You can also use `weights=ResNet18_Weights.DEFAULT` to get the most up-to-date weights.
  warnings.warn(msg)
[I 2024-03-08 18:30:33,541] Trial 41 finished with value: 1.6793060718711266 and parameters: {'knn_metric': 'euclidean', 'n_neighbors': 38, 'batch_size': 128}. Best is trial 12 with value: 1.6879801734820328.
/ghome/group07/anaconda3/envs/torch/lib/python3.10/site-packages/torchvision/models/_utils.py:223: UserWarning: Arguments other than a weight enum or `None` for 'weights' are deprecated since 0.13 and may be removed in the future. The current behavior is equivalent to passing `weights=ResNet18_Weights.IMAGENET1K_V1`. You can also use `weights=ResNet18_Weights.DEFAULT` to get the most up-to-date weights.
  warnings.warn(msg)
[I 2024-03-08 18:30:38,085] Trial 42 finished with value: 1.6850061957868645 and parameters: {'knn_metric': 'euclidean', 'n_neighbors': 46, 'batch_size': 128}. Best is trial 12 with value: 1.6879801734820328.
/ghome/group07/anaconda3/envs/torch/lib/python3.10/site-packages/torchvision/models/_utils.py:223: UserWarning: Arguments other than a weight enum or `None` for 'weights' are deprecated since 0.13 and may be removed in the future. The current behavior is equivalent to passing `weights=ResNet18_Weights.IMAGENET1K_V1`. You can also use `weights=ResNet18_Weights.DEFAULT` to get the most up-to-date weights.
  warnings.warn(msg)
[I 2024-03-08 18:30:42,603] Trial 43 finished with value: 1.6765799256505578 and parameters: {'knn_metric': 'euclidean', 'n_neighbors': 46, 'batch_size': 128}. Best is trial 12 with value: 1.6879801734820328.
/ghome/group07/anaconda3/envs/torch/lib/python3.10/site-packages/torchvision/models/_utils.py:223: UserWarning: Arguments other than a weight enum or `None` for 'weights' are deprecated since 0.13 and may be removed in the future. The current behavior is equivalent to passing `weights=ResNet18_Weights.IMAGENET1K_V1`. You can also use `weights=ResNet18_Weights.DEFAULT` to get the most up-to-date weights.
  warnings.warn(msg)
[I 2024-03-08 18:30:47,154] Trial 44 finished with value: 1.6758364312267655 and parameters: {'knn_metric': 'euclidean', 'n_neighbors': 47, 'batch_size': 128}. Best is trial 12 with value: 1.6879801734820328.
/ghome/group07/anaconda3/envs/torch/lib/python3.10/site-packages/torchvision/models/_utils.py:223: UserWarning: Arguments other than a weight enum or `None` for 'weights' are deprecated since 0.13 and may be removed in the future. The current behavior is equivalent to passing `weights=ResNet18_Weights.IMAGENET1K_V1`. You can also use `weights=ResNet18_Weights.DEFAULT` to get the most up-to-date weights.
  warnings.warn(msg)
[I 2024-03-08 18:30:52,301] Trial 45 finished with value: 1.582403965303593 and parameters: {'knn_metric': 'manhattan', 'n_neighbors': 50, 'batch_size': 16}. Best is trial 12 with value: 1.6879801734820328.
/ghome/group07/anaconda3/envs/torch/lib/python3.10/site-packages/torchvision/models/_utils.py:223: UserWarning: Arguments other than a weight enum or `None` for 'weights' are deprecated since 0.13 and may be removed in the future. The current behavior is equivalent to passing `weights=ResNet18_Weights.IMAGENET1K_V1`. You can also use `weights=ResNet18_Weights.DEFAULT` to get the most up-to-date weights.
  warnings.warn(msg)
[I 2024-03-08 18:30:56,825] Trial 46 finished with value: 1.6614622057001243 and parameters: {'knn_metric': 'euclidean', 'n_neighbors': 45, 'batch_size': 128}. Best is trial 12 with value: 1.6879801734820328.
/ghome/group07/anaconda3/envs/torch/lib/python3.10/site-packages/torchvision/models/_utils.py:223: UserWarning: Arguments other than a weight enum or `None` for 'weights' are deprecated since 0.13 and may be removed in the future. The current behavior is equivalent to passing `weights=ResNet18_Weights.IMAGENET1K_V1`. You can also use `weights=ResNet18_Weights.DEFAULT` to get the most up-to-date weights.
  warnings.warn(msg)
[I 2024-03-08 18:31:01,233] Trial 47 finished with value: 1.6817843866171005 and parameters: {'knn_metric': 'euclidean', 'n_neighbors': 25, 'batch_size': 128}. Best is trial 12 with value: 1.6879801734820328.
/ghome/group07/anaconda3/envs/torch/lib/python3.10/site-packages/torchvision/models/_utils.py:223: UserWarning: Arguments other than a weight enum or `None` for 'weights' are deprecated since 0.13 and may be removed in the future. The current behavior is equivalent to passing `weights=ResNet18_Weights.IMAGENET1K_V1`. You can also use `weights=ResNet18_Weights.DEFAULT` to get the most up-to-date weights.
  warnings.warn(msg)
[I 2024-03-08 18:31:05,721] Trial 48 finished with value: 1.6859975216852536 and parameters: {'knn_metric': 'minkowski', 'n_neighbors': 42, 'batch_size': 128}. Best is trial 12 with value: 1.6879801734820328.
/ghome/group07/anaconda3/envs/torch/lib/python3.10/site-packages/torchvision/models/_utils.py:223: UserWarning: Arguments other than a weight enum or `None` for 'weights' are deprecated since 0.13 and may be removed in the future. The current behavior is equivalent to passing `weights=ResNet18_Weights.IMAGENET1K_V1`. You can also use `weights=ResNet18_Weights.DEFAULT` to get the most up-to-date weights.
  warnings.warn(msg)
[I 2024-03-08 18:31:09,882] Trial 49 finished with value: 1.623543990086741 and parameters: {'knn_metric': 'minkowski', 'n_neighbors': 43, 'batch_size': 32}. Best is trial 12 with value: 1.6879801734820328.
/ghome/group07/anaconda3/envs/torch/lib/python3.10/site-packages/torchvision/models/_utils.py:223: UserWarning: Arguments other than a weight enum or `None` for 'weights' are deprecated since 0.13 and may be removed in the future. The current behavior is equivalent to passing `weights=ResNet18_Weights.IMAGENET1K_V1`. You can also use `weights=ResNet18_Weights.DEFAULT` to get the most up-to-date weights.
  warnings.warn(msg)
[I 2024-03-08 18:31:14,384] Trial 50 finished with value: 1.6805452292441143 and parameters: {'knn_metric': 'minkowski', 'n_neighbors': 41, 'batch_size': 128}. Best is trial 12 with value: 1.6879801734820328.
/ghome/group07/anaconda3/envs/torch/lib/python3.10/site-packages/torchvision/models/_utils.py:223: UserWarning: Arguments other than a weight enum or `None` for 'weights' are deprecated since 0.13 and may be removed in the future. The current behavior is equivalent to passing `weights=ResNet18_Weights.IMAGENET1K_V1`. You can also use `weights=ResNet18_Weights.DEFAULT` to get the most up-to-date weights.
  warnings.warn(msg)
[I 2024-03-08 18:31:18,823] Trial 51 finished with value: 1.662205700123916 and parameters: {'knn_metric': 'minkowski', 'n_neighbors': 48, 'batch_size': 128}. Best is trial 12 with value: 1.6879801734820328.
/ghome/group07/anaconda3/envs/torch/lib/python3.10/site-packages/torchvision/models/_utils.py:223: UserWarning: Arguments other than a weight enum or `None` for 'weights' are deprecated since 0.13 and may be removed in the future. The current behavior is equivalent to passing `weights=ResNet18_Weights.IMAGENET1K_V1`. You can also use `weights=ResNet18_Weights.DEFAULT` to get the most up-to-date weights.
  warnings.warn(msg)
[I 2024-03-08 18:31:23,250] Trial 52 finished with value: 1.6681536555142502 and parameters: {'knn_metric': 'minkowski', 'n_neighbors': 30, 'batch_size': 128}. Best is trial 12 with value: 1.6879801734820328.
/ghome/group07/anaconda3/envs/torch/lib/python3.10/site-packages/torchvision/models/_utils.py:223: UserWarning: Arguments other than a weight enum or `None` for 'weights' are deprecated since 0.13 and may be removed in the future. The current behavior is equivalent to passing `weights=ResNet18_Weights.IMAGENET1K_V1`. You can also use `weights=ResNet18_Weights.DEFAULT` to get the most up-to-date weights.
  warnings.warn(msg)
[I 2024-03-08 18:31:28,290] Trial 53 finished with value: 1.662701363073111 and parameters: {'knn_metric': 'minkowski', 'n_neighbors': 45, 'batch_size': 128}. Best is trial 12 with value: 1.6879801734820328.
/ghome/group07/anaconda3/envs/torch/lib/python3.10/site-packages/torchvision/models/_utils.py:223: UserWarning: Arguments other than a weight enum or `None` for 'weights' are deprecated since 0.13 and may be removed in the future. The current behavior is equivalent to passing `weights=ResNet18_Weights.IMAGENET1K_V1`. You can also use `weights=ResNet18_Weights.DEFAULT` to get the most up-to-date weights.
  warnings.warn(msg)
[I 2024-03-08 18:31:33,607] Trial 54 finished with value: 1.6485749690210656 and parameters: {'knn_metric': 'manhattan', 'n_neighbors': 36, 'batch_size': 128}. Best is trial 12 with value: 1.6879801734820328.
/ghome/group07/anaconda3/envs/torch/lib/python3.10/site-packages/torchvision/models/_utils.py:223: UserWarning: Arguments other than a weight enum or `None` for 'weights' are deprecated since 0.13 and may be removed in the future. The current behavior is equivalent to passing `weights=ResNet18_Weights.IMAGENET1K_V1`. You can also use `weights=ResNet18_Weights.DEFAULT` to get the most up-to-date weights.
  warnings.warn(msg)
[I 2024-03-08 18:31:37,985] Trial 55 finished with value: 1.6748451053283773 and parameters: {'knn_metric': 'euclidean', 'n_neighbors': 5, 'batch_size': 64}. Best is trial 12 with value: 1.6879801734820328.
/ghome/group07/anaconda3/envs/torch/lib/python3.10/site-packages/torchvision/models/_utils.py:223: UserWarning: Arguments other than a weight enum or `None` for 'weights' are deprecated since 0.13 and may be removed in the future. The current behavior is equivalent to passing `weights=ResNet18_Weights.IMAGENET1K_V1`. You can also use `weights=ResNet18_Weights.DEFAULT` to get the most up-to-date weights.
  warnings.warn(msg)
[I 2024-03-08 18:31:42,441] Trial 56 finished with value: 1.6691449814126393 and parameters: {'knn_metric': 'euclidean', 'n_neighbors': 40, 'batch_size': 128}. Best is trial 12 with value: 1.6879801734820328.
/ghome/group07/anaconda3/envs/torch/lib/python3.10/site-packages/torchvision/models/_utils.py:223: UserWarning: Arguments other than a weight enum or `None` for 'weights' are deprecated since 0.13 and may be removed in the future. The current behavior is equivalent to passing `weights=ResNet18_Weights.IMAGENET1K_V1`. You can also use `weights=ResNet18_Weights.DEFAULT` to get the most up-to-date weights.
  warnings.warn(msg)
[I 2024-03-08 18:31:47,174] Trial 57 finished with value: 1.5417596034696412 and parameters: {'knn_metric': 'euclidean', 'n_neighbors': 43, 'batch_size': 8}. Best is trial 12 with value: 1.6879801734820328.
/ghome/group07/anaconda3/envs/torch/lib/python3.10/site-packages/torchvision/models/_utils.py:223: UserWarning: Arguments other than a weight enum or `None` for 'weights' are deprecated since 0.13 and may be removed in the future. The current behavior is equivalent to passing `weights=ResNet18_Weights.IMAGENET1K_V1`. You can also use `weights=ResNet18_Weights.DEFAULT` to get the most up-to-date weights.
  warnings.warn(msg)
[I 2024-03-08 18:31:51,683] Trial 58 finished with value: 1.6798017348203218 and parameters: {'knn_metric': 'minkowski', 'n_neighbors': 39, 'batch_size': 128}. Best is trial 12 with value: 1.6879801734820328.
/ghome/group07/anaconda3/envs/torch/lib/python3.10/site-packages/torchvision/models/_utils.py:223: UserWarning: Arguments other than a weight enum or `None` for 'weights' are deprecated since 0.13 and may be removed in the future. The current behavior is equivalent to passing `weights=ResNet18_Weights.IMAGENET1K_V1`. You can also use `weights=ResNet18_Weights.DEFAULT` to get the most up-to-date weights.
  warnings.warn(msg)
[I 2024-03-08 18:31:55,989] Trial 59 finished with value: 1.6002478314745978 and parameters: {'knn_metric': 'euclidean', 'n_neighbors': 34, 'batch_size': 16}. Best is trial 12 with value: 1.6879801734820328.
/ghome/group07/anaconda3/envs/torch/lib/python3.10/site-packages/torchvision/models/_utils.py:223: UserWarning: Arguments other than a weight enum or `None` for 'weights' are deprecated since 0.13 and may be removed in the future. The current behavior is equivalent to passing `weights=ResNet18_Weights.IMAGENET1K_V1`. You can also use `weights=ResNet18_Weights.DEFAULT` to get the most up-to-date weights.
  warnings.warn(msg)
[I 2024-03-08 18:32:00,486] Trial 60 finished with value: 1.6879801734820328 and parameters: {'knn_metric': 'euclidean', 'n_neighbors': 48, 'batch_size': 128}. Best is trial 12 with value: 1.6879801734820328.
/ghome/group07/anaconda3/envs/torch/lib/python3.10/site-packages/torchvision/models/_utils.py:223: UserWarning: Arguments other than a weight enum or `None` for 'weights' are deprecated since 0.13 and may be removed in the future. The current behavior is equivalent to passing `weights=ResNet18_Weights.IMAGENET1K_V1`. You can also use `weights=ResNet18_Weights.DEFAULT` to get the most up-to-date weights.
  warnings.warn(msg)
[I 2024-03-08 18:32:04,940] Trial 61 finished with value: 1.6810408921933089 and parameters: {'knn_metric': 'euclidean', 'n_neighbors': 47, 'batch_size': 128}. Best is trial 12 with value: 1.6879801734820328.
/ghome/group07/anaconda3/envs/torch/lib/python3.10/site-packages/torchvision/models/_utils.py:223: UserWarning: Arguments other than a weight enum or `None` for 'weights' are deprecated since 0.13 and may be removed in the future. The current behavior is equivalent to passing `weights=ResNet18_Weights.IMAGENET1K_V1`. You can also use `weights=ResNet18_Weights.DEFAULT` to get the most up-to-date weights.
  warnings.warn(msg)
[I 2024-03-08 18:32:09,480] Trial 62 finished with value: 1.6726146220570008 and parameters: {'knn_metric': 'euclidean', 'n_neighbors': 49, 'batch_size': 128}. Best is trial 12 with value: 1.6879801734820328.
/ghome/group07/anaconda3/envs/torch/lib/python3.10/site-packages/torchvision/models/_utils.py:223: UserWarning: Arguments other than a weight enum or `None` for 'weights' are deprecated since 0.13 and may be removed in the future. The current behavior is equivalent to passing `weights=ResNet18_Weights.IMAGENET1K_V1`. You can also use `weights=ResNet18_Weights.DEFAULT` to get the most up-to-date weights.
  warnings.warn(msg)
[I 2024-03-08 18:32:14,022] Trial 63 finished with value: 1.7028500619578684 and parameters: {'knn_metric': 'euclidean', 'n_neighbors': 45, 'batch_size': 128}. Best is trial 63 with value: 1.7028500619578684.
/ghome/group07/anaconda3/envs/torch/lib/python3.10/site-packages/torchvision/models/_utils.py:223: UserWarning: Arguments other than a weight enum or `None` for 'weights' are deprecated since 0.13 and may be removed in the future. The current behavior is equivalent to passing `weights=ResNet18_Weights.IMAGENET1K_V1`. You can also use `weights=ResNet18_Weights.DEFAULT` to get the most up-to-date weights.
  warnings.warn(msg)
[I 2024-03-08 18:32:18,490] Trial 64 finished with value: 1.674845105328377 and parameters: {'knn_metric': 'euclidean', 'n_neighbors': 45, 'batch_size': 128}. Best is trial 63 with value: 1.7028500619578684.
/ghome/group07/anaconda3/envs/torch/lib/python3.10/site-packages/torchvision/models/_utils.py:223: UserWarning: Arguments other than a weight enum or `None` for 'weights' are deprecated since 0.13 and may be removed in the future. The current behavior is equivalent to passing `weights=ResNet18_Weights.IMAGENET1K_V1`. You can also use `weights=ResNet18_Weights.DEFAULT` to get the most up-to-date weights.
  warnings.warn(msg)
[I 2024-03-08 18:32:23,054] Trial 65 finished with value: 1.6780669144981415 and parameters: {'knn_metric': 'euclidean', 'n_neighbors': 50, 'batch_size': 64}. Best is trial 63 with value: 1.7028500619578684.
/ghome/group07/anaconda3/envs/torch/lib/python3.10/site-packages/torchvision/models/_utils.py:223: UserWarning: Arguments other than a weight enum or `None` for 'weights' are deprecated since 0.13 and may be removed in the future. The current behavior is equivalent to passing `weights=ResNet18_Weights.IMAGENET1K_V1`. You can also use `weights=ResNet18_Weights.DEFAULT` to get the most up-to-date weights.
  warnings.warn(msg)
[I 2024-03-08 18:32:27,788] Trial 66 finished with value: 1.6760842627013628 and parameters: {'knn_metric': 'euclidean', 'n_neighbors': 44, 'batch_size': 128}. Best is trial 63 with value: 1.7028500619578684.
/ghome/group07/anaconda3/envs/torch/lib/python3.10/site-packages/torchvision/models/_utils.py:223: UserWarning: Arguments other than a weight enum or `None` for 'weights' are deprecated since 0.13 and may be removed in the future. The current behavior is equivalent to passing `weights=ResNet18_Weights.IMAGENET1K_V1`. You can also use `weights=ResNet18_Weights.DEFAULT` to get the most up-to-date weights.
  warnings.warn(msg)
