[I 2024-03-08 18:26:20,959] A new study created in memory with name: no-name-85d1308b-a140-41cd-80d7-3727a2f9580a
/ghome/group07/anaconda3/envs/torch/lib/python3.10/site-packages/torchvision/models/_utils.py:223: UserWarning: Arguments other than a weight enum or `None` for 'weights' are deprecated since 0.13 and may be removed in the future. The current behavior is equivalent to passing `weights=ResNet18_Weights.IMAGENET1K_V1`. You can also use `weights=ResNet18_Weights.DEFAULT` to get the most up-to-date weights.
  warnings.warn(msg)
[I 2024-03-08 18:26:27,065] Trial 0 finished with value: 1.4071871127633218 and parameters: {'knn_metric': 'chebyshev', 'n_neighbors': 22, 'batch_size': 16}. Best is trial 0 with value: 1.4071871127633218.
/ghome/group07/anaconda3/envs/torch/lib/python3.10/site-packages/torchvision/models/_utils.py:223: UserWarning: Arguments other than a weight enum or `None` for 'weights' are deprecated since 0.13 and may be removed in the future. The current behavior is equivalent to passing `weights=ResNet18_Weights.IMAGENET1K_V1`. You can also use `weights=ResNet18_Weights.DEFAULT` to get the most up-to-date weights.
  warnings.warn(msg)
[I 2024-03-08 18:26:32,723] Trial 1 finished with value: 1.3484510532837684 and parameters: {'knn_metric': 'chebyshev', 'n_neighbors': 13, 'batch_size': 8}. Best is trial 0 with value: 1.4071871127633218.
/ghome/group07/anaconda3/envs/torch/lib/python3.10/site-packages/torchvision/models/_utils.py:223: UserWarning: Arguments other than a weight enum or `None` for 'weights' are deprecated since 0.13 and may be removed in the future. The current behavior is equivalent to passing `weights=ResNet18_Weights.IMAGENET1K_V1`. You can also use `weights=ResNet18_Weights.DEFAULT` to get the most up-to-date weights.
  warnings.warn(msg)
[I 2024-03-08 18:26:37,288] Trial 2 finished with value: 1.6802973977695164 and parameters: {'knn_metric': 'minkowski', 'n_neighbors': 23, 'batch_size': 64}. Best is trial 2 with value: 1.6802973977695164.
/ghome/group07/anaconda3/envs/torch/lib/python3.10/site-packages/torchvision/models/_utils.py:223: UserWarning: Arguments other than a weight enum or `None` for 'weights' are deprecated since 0.13 and may be removed in the future. The current behavior is equivalent to passing `weights=ResNet18_Weights.IMAGENET1K_V1`. You can also use `weights=ResNet18_Weights.DEFAULT` to get the most up-to-date weights.
  warnings.warn(msg)
[I 2024-03-08 18:26:41,706] Trial 3 finished with value: 1.599752168525403 and parameters: {'knn_metric': 'minkowski', 'n_neighbors': 46, 'batch_size': 16}. Best is trial 2 with value: 1.6802973977695164.
/ghome/group07/anaconda3/envs/torch/lib/python3.10/site-packages/torchvision/models/_utils.py:223: UserWarning: Arguments other than a weight enum or `None` for 'weights' are deprecated since 0.13 and may be removed in the future. The current behavior is equivalent to passing `weights=ResNet18_Weights.IMAGENET1K_V1`. You can also use `weights=ResNet18_Weights.DEFAULT` to get the most up-to-date weights.
  warnings.warn(msg)
[I 2024-03-08 18:26:47,395] Trial 4 finished with value: 1.3132589838909552 and parameters: {'knn_metric': 'chebyshev', 'n_neighbors': 12, 'batch_size': 8}. Best is trial 2 with value: 1.6802973977695164.
/ghome/group07/anaconda3/envs/torch/lib/python3.10/site-packages/torchvision/models/_utils.py:223: UserWarning: Arguments other than a weight enum or `None` for 'weights' are deprecated since 0.13 and may be removed in the future. The current behavior is equivalent to passing `weights=ResNet18_Weights.IMAGENET1K_V1`. You can also use `weights=ResNet18_Weights.DEFAULT` to get the most up-to-date weights.
  warnings.warn(msg)
[I 2024-03-08 18:26:52,434] Trial 5 finished with value: 1.5660470879801753 and parameters: {'knn_metric': 'manhattan', 'n_neighbors': 7, 'batch_size': 16}. Best is trial 2 with value: 1.6802973977695164.
/ghome/group07/anaconda3/envs/torch/lib/python3.10/site-packages/torchvision/models/_utils.py:223: UserWarning: Arguments other than a weight enum or `None` for 'weights' are deprecated since 0.13 and may be removed in the future. The current behavior is equivalent to passing `weights=ResNet18_Weights.IMAGENET1K_V1`. You can also use `weights=ResNet18_Weights.DEFAULT` to get the most up-to-date weights.
  warnings.warn(msg)
[I 2024-03-08 18:26:58,010] Trial 6 finished with value: 1.6741016109045845 and parameters: {'knn_metric': 'euclidean', 'n_neighbors': 29, 'batch_size': 128}. Best is trial 2 with value: 1.6802973977695164.
/ghome/group07/anaconda3/envs/torch/lib/python3.10/site-packages/torchvision/models/_utils.py:223: UserWarning: Arguments other than a weight enum or `None` for 'weights' are deprecated since 0.13 and may be removed in the future. The current behavior is equivalent to passing `weights=ResNet18_Weights.IMAGENET1K_V1`. You can also use `weights=ResNet18_Weights.DEFAULT` to get the most up-to-date weights.
  warnings.warn(msg)
[I 2024-03-08 18:27:03,268] Trial 7 finished with value: 1.631970260223048 and parameters: {'knn_metric': 'manhattan', 'n_neighbors': 37, 'batch_size': 32}. Best is trial 2 with value: 1.6802973977695164.
/ghome/group07/anaconda3/envs/torch/lib/python3.10/site-packages/torchvision/models/_utils.py:223: UserWarning: Arguments other than a weight enum or `None` for 'weights' are deprecated since 0.13 and may be removed in the future. The current behavior is equivalent to passing `weights=ResNet18_Weights.IMAGENET1K_V1`. You can also use `weights=ResNet18_Weights.DEFAULT` to get the most up-to-date weights.
  warnings.warn(msg)
[I 2024-03-08 18:27:08,728] Trial 8 finished with value: 1.6701363073110282 and parameters: {'knn_metric': 'manhattan', 'n_neighbors': 11, 'batch_size': 128}. Best is trial 2 with value: 1.6802973977695164.
/ghome/group07/anaconda3/envs/torch/lib/python3.10/site-packages/torchvision/models/_utils.py:223: UserWarning: Arguments other than a weight enum or `None` for 'weights' are deprecated since 0.13 and may be removed in the future. The current behavior is equivalent to passing `weights=ResNet18_Weights.IMAGENET1K_V1`. You can also use `weights=ResNet18_Weights.DEFAULT` to get the most up-to-date weights.
  warnings.warn(msg)
[I 2024-03-08 18:27:13,976] Trial 9 finished with value: 1.6329615861214377 and parameters: {'knn_metric': 'manhattan', 'n_neighbors': 27, 'batch_size': 64}. Best is trial 2 with value: 1.6802973977695164.
/ghome/group07/anaconda3/envs/torch/lib/python3.10/site-packages/torchvision/models/_utils.py:223: UserWarning: Arguments other than a weight enum or `None` for 'weights' are deprecated since 0.13 and may be removed in the future. The current behavior is equivalent to passing `weights=ResNet18_Weights.IMAGENET1K_V1`. You can also use `weights=ResNet18_Weights.DEFAULT` to get the most up-to-date weights.
  warnings.warn(msg)
[I 2024-03-08 18:27:18,429] Trial 10 finished with value: 1.6567534076827752 and parameters: {'knn_metric': 'minkowski', 'n_neighbors': 21, 'batch_size': 64}. Best is trial 2 with value: 1.6802973977695164.
/ghome/group07/anaconda3/envs/torch/lib/python3.10/site-packages/torchvision/models/_utils.py:223: UserWarning: Arguments other than a weight enum or `None` for 'weights' are deprecated since 0.13 and may be removed in the future. The current behavior is equivalent to passing `weights=ResNet18_Weights.IMAGENET1K_V1`. You can also use `weights=ResNet18_Weights.DEFAULT` to get the most up-to-date weights.
  warnings.warn(msg)
[I 2024-03-08 18:27:22,960] Trial 11 finished with value: 1.6765799256505582 and parameters: {'knn_metric': 'euclidean', 'n_neighbors': 34, 'batch_size': 128}. Best is trial 2 with value: 1.6802973977695164.
/ghome/group07/anaconda3/envs/torch/lib/python3.10/site-packages/torchvision/models/_utils.py:223: UserWarning: Arguments other than a weight enum or `None` for 'weights' are deprecated since 0.13 and may be removed in the future. The current behavior is equivalent to passing `weights=ResNet18_Weights.IMAGENET1K_V1`. You can also use `weights=ResNet18_Weights.DEFAULT` to get the most up-to-date weights.
  warnings.warn(msg)
[I 2024-03-08 18:27:27,426] Trial 12 finished with value: 1.6879801734820328 and parameters: {'knn_metric': 'euclidean', 'n_neighbors': 37, 'batch_size': 128}. Best is trial 12 with value: 1.6879801734820328.
/ghome/group07/anaconda3/envs/torch/lib/python3.10/site-packages/torchvision/models/_utils.py:223: UserWarning: Arguments other than a weight enum or `None` for 'weights' are deprecated since 0.13 and may be removed in the future. The current behavior is equivalent to passing `weights=ResNet18_Weights.IMAGENET1K_V1`. You can also use `weights=ResNet18_Weights.DEFAULT` to get the most up-to-date weights.
  warnings.warn(msg)
[I 2024-03-08 18:27:31,862] Trial 13 finished with value: 1.6822800495662946 and parameters: {'knn_metric': 'minkowski', 'n_neighbors': 44, 'batch_size': 64}. Best is trial 12 with value: 1.6879801734820328.
/ghome/group07/anaconda3/envs/torch/lib/python3.10/site-packages/torchvision/models/_utils.py:223: UserWarning: Arguments other than a weight enum or `None` for 'weights' are deprecated since 0.13 and may be removed in the future. The current behavior is equivalent to passing `weights=ResNet18_Weights.IMAGENET1K_V1`. You can also use `weights=ResNet18_Weights.DEFAULT` to get the most up-to-date weights.
  warnings.warn(msg)
[I 2024-03-08 18:27:36,268] Trial 14 finished with value: 1.629987608426271 and parameters: {'knn_metric': 'euclidean', 'n_neighbors': 49, 'batch_size': 32}. Best is trial 12 with value: 1.6879801734820328.
/ghome/group07/anaconda3/envs/torch/lib/python3.10/site-packages/torchvision/models/_utils.py:223: UserWarning: Arguments other than a weight enum or `None` for 'weights' are deprecated since 0.13 and may be removed in the future. The current behavior is equivalent to passing `weights=ResNet18_Weights.IMAGENET1K_V1`. You can also use `weights=ResNet18_Weights.DEFAULT` to get the most up-to-date weights.
  warnings.warn(msg)
[I 2024-03-08 18:27:42,379] Trial 15 finished with value: 1.6708798017348203 and parameters: {'knn_metric': 'euclidean', 'n_neighbors': 42, 'batch_size': 128}. Best is trial 12 with value: 1.6879801734820328.
/ghome/group07/anaconda3/envs/torch/lib/python3.10/site-packages/torchvision/models/_utils.py:223: UserWarning: Arguments other than a weight enum or `None` for 'weights' are deprecated since 0.13 and may be removed in the future. The current behavior is equivalent to passing `weights=ResNet18_Weights.IMAGENET1K_V1`. You can also use `weights=ResNet18_Weights.DEFAULT` to get the most up-to-date weights.
  warnings.warn(msg)
[I 2024-03-08 18:27:46,462] Trial 16 finished with value: 1.6721189591078058 and parameters: {'knn_metric': 'minkowski', 'n_neighbors': 39, 'batch_size': 64}. Best is trial 12 with value: 1.6879801734820328.
/ghome/group07/anaconda3/envs/torch/lib/python3.10/site-packages/torchvision/models/_utils.py:223: UserWarning: Arguments other than a weight enum or `None` for 'weights' are deprecated since 0.13 and may be removed in the future. The current behavior is equivalent to passing `weights=ResNet18_Weights.IMAGENET1K_V1`. You can also use `weights=ResNet18_Weights.DEFAULT` to get the most up-to-date weights.
  warnings.warn(msg)
[I 2024-03-08 18:27:50,969] Trial 17 finished with value: 1.6857496902106563 and parameters: {'knn_metric': 'euclidean', 'n_neighbors': 44, 'batch_size': 128}. Best is trial 12 with value: 1.6879801734820328.
/ghome/group07/anaconda3/envs/torch/lib/python3.10/site-packages/torchvision/models/_utils.py:223: UserWarning: Arguments other than a weight enum or `None` for 'weights' are deprecated since 0.13 and may be removed in the future. The current behavior is equivalent to passing `weights=ResNet18_Weights.IMAGENET1K_V1`. You can also use `weights=ResNet18_Weights.DEFAULT` to get the most up-to-date weights.
  warnings.warn(msg)
[I 2024-03-08 18:27:55,669] Trial 18 finished with value: 1.6788104089219331 and parameters: {'knn_metric': 'euclidean', 'n_neighbors': 32, 'batch_size': 128}. Best is trial 12 with value: 1.6879801734820328.
/ghome/group07/anaconda3/envs/torch/lib/python3.10/site-packages/torchvision/models/_utils.py:223: UserWarning: Arguments other than a weight enum or `None` for 'weights' are deprecated since 0.13 and may be removed in the future. The current behavior is equivalent to passing `weights=ResNet18_Weights.IMAGENET1K_V1`. You can also use `weights=ResNet18_Weights.DEFAULT` to get the most up-to-date weights.
  warnings.warn(msg)
[I 2024-03-08 18:28:00,243] Trial 19 finished with value: 1.6708798017348203 and parameters: {'knn_metric': 'euclidean', 'n_neighbors': 50, 'batch_size': 128}. Best is trial 12 with value: 1.6879801734820328.
/ghome/group07/anaconda3/envs/torch/lib/python3.10/site-packages/torchvision/models/_utils.py:223: UserWarning: Arguments other than a weight enum or `None` for 'weights' are deprecated since 0.13 and may be removed in the future. The current behavior is equivalent to passing `weights=ResNet18_Weights.IMAGENET1K_V1`. You can also use `weights=ResNet18_Weights.DEFAULT` to get the most up-to-date weights.
  warnings.warn(msg)
[I 2024-03-08 18:28:04,753] Trial 20 finished with value: 1.6765799256505587 and parameters: {'knn_metric': 'euclidean', 'n_neighbors': 40, 'batch_size': 128}. Best is trial 12 with value: 1.6879801734820328.
/ghome/group07/anaconda3/envs/torch/lib/python3.10/site-packages/torchvision/models/_utils.py:223: UserWarning: Arguments other than a weight enum or `None` for 'weights' are deprecated since 0.13 and may be removed in the future. The current behavior is equivalent to passing `weights=ResNet18_Weights.IMAGENET1K_V1`. You can also use `weights=ResNet18_Weights.DEFAULT` to get the most up-to-date weights.
  warnings.warn(msg)
[I 2024-03-08 18:28:09,050] Trial 21 finished with value: 1.6594795539033456 and parameters: {'knn_metric': 'minkowski', 'n_neighbors': 44, 'batch_size': 64}. Best is trial 12 with value: 1.6879801734820328.
/ghome/group07/anaconda3/envs/torch/lib/python3.10/site-packages/torchvision/models/_utils.py:223: UserWarning: Arguments other than a weight enum or `None` for 'weights' are deprecated since 0.13 and may be removed in the future. The current behavior is equivalent to passing `weights=ResNet18_Weights.IMAGENET1K_V1`. You can also use `weights=ResNet18_Weights.DEFAULT` to get the most up-to-date weights.
  warnings.warn(msg)
[I 2024-03-08 18:28:13,668] Trial 22 finished with value: 1.6850061957868654 and parameters: {'knn_metric': 'euclidean', 'n_neighbors': 45, 'batch_size': 128}. Best is trial 12 with value: 1.6879801734820328.
/ghome/group07/anaconda3/envs/torch/lib/python3.10/site-packages/torchvision/models/_utils.py:223: UserWarning: Arguments other than a weight enum or `None` for 'weights' are deprecated since 0.13 and may be removed in the future. The current behavior is equivalent to passing `weights=ResNet18_Weights.IMAGENET1K_V1`. You can also use `weights=ResNet18_Weights.DEFAULT` to get the most up-to-date weights.
  warnings.warn(msg)
[I 2024-03-08 18:28:18,355] Trial 23 finished with value: 1.6847583643122668 and parameters: {'knn_metric': 'euclidean', 'n_neighbors': 35, 'batch_size': 128}. Best is trial 12 with value: 1.6879801734820328.
/ghome/group07/anaconda3/envs/torch/lib/python3.10/site-packages/torchvision/models/_utils.py:223: UserWarning: Arguments other than a weight enum or `None` for 'weights' are deprecated since 0.13 and may be removed in the future. The current behavior is equivalent to passing `weights=ResNet18_Weights.IMAGENET1K_V1`. You can also use `weights=ResNet18_Weights.DEFAULT` to get the most up-to-date weights.
  warnings.warn(msg)
[I 2024-03-08 18:28:22,849] Trial 24 finished with value: 1.6728624535315981 and parameters: {'knn_metric': 'euclidean', 'n_neighbors': 48, 'batch_size': 128}. Best is trial 12 with value: 1.6879801734820328.
/ghome/group07/anaconda3/envs/torch/lib/python3.10/site-packages/torchvision/models/_utils.py:223: UserWarning: Arguments other than a weight enum or `None` for 'weights' are deprecated since 0.13 and may be removed in the future. The current behavior is equivalent to passing `weights=ResNet18_Weights.IMAGENET1K_V1`. You can also use `weights=ResNet18_Weights.DEFAULT` to get the most up-to-date weights.
  warnings.warn(msg)
[I 2024-03-08 18:28:27,322] Trial 25 finished with value: 1.6827757125154883 and parameters: {'knn_metric': 'euclidean', 'n_neighbors': 40, 'batch_size': 128}. Best is trial 12 with value: 1.6879801734820328.
/ghome/group07/anaconda3/envs/torch/lib/python3.10/site-packages/torchvision/models/_utils.py:223: UserWarning: Arguments other than a weight enum or `None` for 'weights' are deprecated since 0.13 and may be removed in the future. The current behavior is equivalent to passing `weights=ResNet18_Weights.IMAGENET1K_V1`. You can also use `weights=ResNet18_Weights.DEFAULT` to get the most up-to-date weights.
  warnings.warn(msg)
[I 2024-03-08 18:28:31,626] Trial 26 finished with value: 1.6337050805452302 and parameters: {'knn_metric': 'euclidean', 'n_neighbors': 45, 'batch_size': 32}. Best is trial 12 with value: 1.6879801734820328.
/ghome/group07/anaconda3/envs/torch/lib/python3.10/site-packages/torchvision/models/_utils.py:223: UserWarning: Arguments other than a weight enum or `None` for 'weights' are deprecated since 0.13 and may be removed in the future. The current behavior is equivalent to passing `weights=ResNet18_Weights.IMAGENET1K_V1`. You can also use `weights=ResNet18_Weights.DEFAULT` to get the most up-to-date weights.
  warnings.warn(msg)
[I 2024-03-08 18:28:36,259] Trial 27 finished with value: 1.6820322180916967 and parameters: {'knn_metric': 'euclidean', 'n_neighbors': 30, 'batch_size': 128}. Best is trial 12 with value: 1.6879801734820328.
/ghome/group07/anaconda3/envs/torch/lib/python3.10/site-packages/torchvision/models/_utils.py:223: UserWarning: Arguments other than a weight enum or `None` for 'weights' are deprecated since 0.13 and may be removed in the future. The current behavior is equivalent to passing `weights=ResNet18_Weights.IMAGENET1K_V1`. You can also use `weights=ResNet18_Weights.DEFAULT` to get the most up-to-date weights.
  warnings.warn(msg)
[I 2024-03-08 18:28:41,198] Trial 28 finished with value: 1.5184634448574976 and parameters: {'knn_metric': 'euclidean', 'n_neighbors': 36, 'batch_size': 8}. Best is trial 12 with value: 1.6879801734820328.
/ghome/group07/anaconda3/envs/torch/lib/python3.10/site-packages/torchvision/models/_utils.py:223: UserWarning: Arguments other than a weight enum or `None` for 'weights' are deprecated since 0.13 and may be removed in the future. The current behavior is equivalent to passing `weights=ResNet18_Weights.IMAGENET1K_V1`. You can also use `weights=ResNet18_Weights.DEFAULT` to get the most up-to-date weights.
  warnings.warn(msg)
[I 2024-03-08 18:28:45,671] Trial 29 finished with value: 1.5942998760842624 and parameters: {'knn_metric': 'euclidean', 'n_neighbors': 42, 'batch_size': 16}. Best is trial 12 with value: 1.6879801734820328.
/ghome/group07/anaconda3/envs/torch/lib/python3.10/site-packages/torchvision/models/_utils.py:223: UserWarning: Arguments other than a weight enum or `None` for 'weights' are deprecated since 0.13 and may be removed in the future. The current behavior is equivalent to passing `weights=ResNet18_Weights.IMAGENET1K_V1`. You can also use `weights=ResNet18_Weights.DEFAULT` to get the most up-to-date weights.
  warnings.warn(msg)
[I 2024-03-08 18:28:51,138] Trial 30 finished with value: 1.5420074349442388 and parameters: {'knn_metric': 'chebyshev', 'n_neighbors': 47, 'batch_size': 128}. Best is trial 12 with value: 1.6879801734820328.
/ghome/group07/anaconda3/envs/torch/lib/python3.10/site-packages/torchvision/models/_utils.py:223: UserWarning: Arguments other than a weight enum or `None` for 'weights' are deprecated since 0.13 and may be removed in the future. The current behavior is equivalent to passing `weights=ResNet18_Weights.IMAGENET1K_V1`. You can also use `weights=ResNet18_Weights.DEFAULT` to get the most up-to-date weights.
  warnings.warn(msg)
[I 2024-03-08 18:28:56,137] Trial 31 finished with value: 1.6765799256505582 and parameters: {'knn_metric': 'euclidean', 'n_neighbors': 35, 'batch_size': 128}. Best is trial 12 with value: 1.6879801734820328.
/ghome/group07/anaconda3/envs/torch/lib/python3.10/site-packages/torchvision/models/_utils.py:223: UserWarning: Arguments other than a weight enum or `None` for 'weights' are deprecated since 0.13 and may be removed in the future. The current behavior is equivalent to passing `weights=ResNet18_Weights.IMAGENET1K_V1`. You can also use `weights=ResNet18_Weights.DEFAULT` to get the most up-to-date weights.
  warnings.warn(msg)
[I 2024-03-08 18:29:00,639] Trial 32 finished with value: 1.6840148698884763 and parameters: {'knn_metric': 'euclidean', 'n_neighbors': 38, 'batch_size': 128}. Best is trial 12 with value: 1.6879801734820328.
/ghome/group07/anaconda3/envs/torch/lib/python3.10/site-packages/torchvision/models/_utils.py:223: UserWarning: Arguments other than a weight enum or `None` for 'weights' are deprecated since 0.13 and may be removed in the future. The current behavior is equivalent to passing `weights=ResNet18_Weights.IMAGENET1K_V1`. You can also use `weights=ResNet18_Weights.DEFAULT` to get the most up-to-date weights.
  warnings.warn(msg)
