[I 2024-03-08 18:32:33,119] Trial 67 finished with value: 1.514745972738538 and parameters: {'knn_metric': 'chebyshev', 'n_neighbors': 48, 'batch_size': 128}. Best is trial 63 with value: 1.7028500619578684.
/ghome/group07/anaconda3/envs/torch/lib/python3.10/site-packages/torchvision/models/_utils.py:223: UserWarning: Arguments other than a weight enum or `None` for 'weights' are deprecated since 0.13 and may be removed in the future. The current behavior is equivalent to passing `weights=ResNet18_Weights.IMAGENET1K_V1`. You can also use `weights=ResNet18_Weights.DEFAULT` to get the most up-to-date weights.
  warnings.warn(msg)
[I 2024-03-08 18:32:37,326] Trial 68 finished with value: 1.6389095415117723 and parameters: {'knn_metric': 'euclidean', 'n_neighbors': 42, 'batch_size': 32}. Best is trial 63 with value: 1.7028500619578684.
/ghome/group07/anaconda3/envs/torch/lib/python3.10/site-packages/torchvision/models/_utils.py:223: UserWarning: Arguments other than a weight enum or `None` for 'weights' are deprecated since 0.13 and may be removed in the future. The current behavior is equivalent to passing `weights=ResNet18_Weights.IMAGENET1K_V1`. You can also use `weights=ResNet18_Weights.DEFAULT` to get the most up-to-date weights.
  warnings.warn(msg)
[I 2024-03-08 18:32:42,677] Trial 69 finished with value: 1.6884758364312273 and parameters: {'knn_metric': 'manhattan', 'n_neighbors': 47, 'batch_size': 128}. Best is trial 63 with value: 1.7028500619578684.
/ghome/group07/anaconda3/envs/torch/lib/python3.10/site-packages/torchvision/models/_utils.py:223: UserWarning: Arguments other than a weight enum or `None` for 'weights' are deprecated since 0.13 and may be removed in the future. The current behavior is equivalent to passing `weights=ResNet18_Weights.IMAGENET1K_V1`. You can also use `weights=ResNet18_Weights.DEFAULT` to get the most up-to-date weights.
  warnings.warn(msg)
[I 2024-03-08 18:32:48,013] Trial 70 finished with value: 1.6728624535315983 and parameters: {'knn_metric': 'manhattan', 'n_neighbors': 44, 'batch_size': 128}. Best is trial 63 with value: 1.7028500619578684.
/ghome/group07/anaconda3/envs/torch/lib/python3.10/site-packages/torchvision/models/_utils.py:223: UserWarning: Arguments other than a weight enum or `None` for 'weights' are deprecated since 0.13 and may be removed in the future. The current behavior is equivalent to passing `weights=ResNet18_Weights.IMAGENET1K_V1`. You can also use `weights=ResNet18_Weights.DEFAULT` to get the most up-to-date weights.
  warnings.warn(msg)
[I 2024-03-08 18:32:53,321] Trial 71 finished with value: 1.6753407682775712 and parameters: {'knn_metric': 'manhattan', 'n_neighbors': 46, 'batch_size': 128}. Best is trial 63 with value: 1.7028500619578684.
/ghome/group07/anaconda3/envs/torch/lib/python3.10/site-packages/torchvision/models/_utils.py:223: UserWarning: Arguments other than a weight enum or `None` for 'weights' are deprecated since 0.13 and may be removed in the future. The current behavior is equivalent to passing `weights=ResNet18_Weights.IMAGENET1K_V1`. You can also use `weights=ResNet18_Weights.DEFAULT` to get the most up-to-date weights.
  warnings.warn(msg)
[I 2024-03-08 18:32:58,628] Trial 72 finished with value: 1.6666666666666674 and parameters: {'knn_metric': 'manhattan', 'n_neighbors': 49, 'batch_size': 128}. Best is trial 63 with value: 1.7028500619578684.
/ghome/group07/anaconda3/envs/torch/lib/python3.10/site-packages/torchvision/models/_utils.py:223: UserWarning: Arguments other than a weight enum or `None` for 'weights' are deprecated since 0.13 and may be removed in the future. The current behavior is equivalent to passing `weights=ResNet18_Weights.IMAGENET1K_V1`. You can also use `weights=ResNet18_Weights.DEFAULT` to get the most up-to-date weights.
  warnings.warn(msg)
[I 2024-03-08 18:33:03,860] Trial 73 finished with value: 1.651796778190831 and parameters: {'knn_metric': 'manhattan', 'n_neighbors': 47, 'batch_size': 128}. Best is trial 63 with value: 1.7028500619578684.
/ghome/group07/anaconda3/envs/torch/lib/python3.10/site-packages/torchvision/models/_utils.py:223: UserWarning: Arguments other than a weight enum or `None` for 'weights' are deprecated since 0.13 and may be removed in the future. The current behavior is equivalent to passing `weights=ResNet18_Weights.IMAGENET1K_V1`. You can also use `weights=ResNet18_Weights.DEFAULT` to get the most up-to-date weights.
  warnings.warn(msg)
[I 2024-03-08 18:33:08,319] Trial 74 finished with value: 1.6869888475836428 and parameters: {'knn_metric': 'euclidean', 'n_neighbors': 41, 'batch_size': 128}. Best is trial 63 with value: 1.7028500619578684.
/ghome/group07/anaconda3/envs/torch/lib/python3.10/site-packages/torchvision/models/_utils.py:223: UserWarning: Arguments other than a weight enum or `None` for 'weights' are deprecated since 0.13 and may be removed in the future. The current behavior is equivalent to passing `weights=ResNet18_Weights.IMAGENET1K_V1`. You can also use `weights=ResNet18_Weights.DEFAULT` to get the most up-to-date weights.
  warnings.warn(msg)
[I 2024-03-08 18:33:12,707] Trial 75 finished with value: 1.6773234200743496 and parameters: {'knn_metric': 'minkowski', 'n_neighbors': 41, 'batch_size': 128}. Best is trial 63 with value: 1.7028500619578684.
/ghome/group07/anaconda3/envs/torch/lib/python3.10/site-packages/torchvision/models/_utils.py:223: UserWarning: Arguments other than a weight enum or `None` for 'weights' are deprecated since 0.13 and may be removed in the future. The current behavior is equivalent to passing `weights=ResNet18_Weights.IMAGENET1K_V1`. You can also use `weights=ResNet18_Weights.DEFAULT` to get the most up-to-date weights.
  warnings.warn(msg)
[I 2024-03-08 18:33:17,486] Trial 76 finished with value: 1.506071871127634 and parameters: {'knn_metric': 'euclidean', 'n_neighbors': 42, 'batch_size': 8}. Best is trial 63 with value: 1.7028500619578684.
/ghome/group07/anaconda3/envs/torch/lib/python3.10/site-packages/torchvision/models/_utils.py:223: UserWarning: Arguments other than a weight enum or `None` for 'weights' are deprecated since 0.13 and may be removed in the future. The current behavior is equivalent to passing `weights=ResNet18_Weights.IMAGENET1K_V1`. You can also use `weights=ResNet18_Weights.DEFAULT` to get the most up-to-date weights.
  warnings.warn(msg)
[I 2024-03-08 18:33:22,724] Trial 77 finished with value: 1.6785625774473352 and parameters: {'knn_metric': 'manhattan', 'n_neighbors': 39, 'batch_size': 128}. Best is trial 63 with value: 1.7028500619578684.
/ghome/group07/anaconda3/envs/torch/lib/python3.10/site-packages/torchvision/models/_utils.py:223: UserWarning: Arguments other than a weight enum or `None` for 'weights' are deprecated since 0.13 and may be removed in the future. The current behavior is equivalent to passing `weights=ResNet18_Weights.IMAGENET1K_V1`. You can also use `weights=ResNet18_Weights.DEFAULT` to get the most up-to-date weights.
  warnings.warn(msg)
[I 2024-03-08 18:33:27,165] Trial 78 finished with value: 1.6830235439900862 and parameters: {'knn_metric': 'euclidean', 'n_neighbors': 44, 'batch_size': 128}. Best is trial 63 with value: 1.7028500619578684.
/ghome/group07/anaconda3/envs/torch/lib/python3.10/site-packages/torchvision/models/_utils.py:223: UserWarning: Arguments other than a weight enum or `None` for 'weights' are deprecated since 0.13 and may be removed in the future. The current behavior is equivalent to passing `weights=ResNet18_Weights.IMAGENET1K_V1`. You can also use `weights=ResNet18_Weights.DEFAULT` to get the most up-to-date weights.
  warnings.warn(msg)
[I 2024-03-08 18:33:31,439] Trial 79 finished with value: 1.5848822800495663 and parameters: {'knn_metric': 'euclidean', 'n_neighbors': 43, 'batch_size': 16}. Best is trial 63 with value: 1.7028500619578684.
/ghome/group07/anaconda3/envs/torch/lib/python3.10/site-packages/torchvision/models/_utils.py:223: UserWarning: Arguments other than a weight enum or `None` for 'weights' are deprecated since 0.13 and may be removed in the future. The current behavior is equivalent to passing `weights=ResNet18_Weights.IMAGENET1K_V1`. You can also use `weights=ResNet18_Weights.DEFAULT` to get the most up-to-date weights.
  warnings.warn(msg)
[I 2024-03-08 18:33:36,488] Trial 80 finished with value: 1.5030978934324666 and parameters: {'knn_metric': 'chebyshev', 'n_neighbors': 48, 'batch_size': 64}. Best is trial 63 with value: 1.7028500619578684.
/ghome/group07/anaconda3/envs/torch/lib/python3.10/site-packages/torchvision/models/_utils.py:223: UserWarning: Arguments other than a weight enum or `None` for 'weights' are deprecated since 0.13 and may be removed in the future. The current behavior is equivalent to passing `weights=ResNet18_Weights.IMAGENET1K_V1`. You can also use `weights=ResNet18_Weights.DEFAULT` to get the most up-to-date weights.
  warnings.warn(msg)
[I 2024-03-08 18:33:41,013] Trial 81 finished with value: 1.6723667905824036 and parameters: {'knn_metric': 'euclidean', 'n_neighbors': 46, 'batch_size': 128}. Best is trial 63 with value: 1.7028500619578684.
/ghome/group07/anaconda3/envs/torch/lib/python3.10/site-packages/torchvision/models/_utils.py:223: UserWarning: Arguments other than a weight enum or `None` for 'weights' are deprecated since 0.13 and may be removed in the future. The current behavior is equivalent to passing `weights=ResNet18_Weights.IMAGENET1K_V1`. You can also use `weights=ResNet18_Weights.DEFAULT` to get the most up-to-date weights.
  warnings.warn(msg)
[I 2024-03-08 18:33:45,485] Trial 82 finished with value: 1.6842627013630724 and parameters: {'knn_metric': 'euclidean', 'n_neighbors': 46, 'batch_size': 128}. Best is trial 63 with value: 1.7028500619578684.
/ghome/group07/anaconda3/envs/torch/lib/python3.10/site-packages/torchvision/models/_utils.py:223: UserWarning: Arguments other than a weight enum or `None` for 'weights' are deprecated since 0.13 and may be removed in the future. The current behavior is equivalent to passing `weights=ResNet18_Weights.IMAGENET1K_V1`. You can also use `weights=ResNet18_Weights.DEFAULT` to get the most up-to-date weights.
  warnings.warn(msg)
[I 2024-03-08 18:33:49,932] Trial 83 finished with value: 1.6597273853779428 and parameters: {'knn_metric': 'euclidean', 'n_neighbors': 41, 'batch_size': 128}. Best is trial 63 with value: 1.7028500619578684.
/ghome/group07/anaconda3/envs/torch/lib/python3.10/site-packages/torchvision/models/_utils.py:223: UserWarning: Arguments other than a weight enum or `None` for 'weights' are deprecated since 0.13 and may be removed in the future. The current behavior is equivalent to passing `weights=ResNet18_Weights.IMAGENET1K_V1`. You can also use `weights=ResNet18_Weights.DEFAULT` to get the most up-to-date weights.
  warnings.warn(msg)
[I 2024-03-08 18:33:54,629] Trial 84 finished with value: 1.6939281288723667 and parameters: {'knn_metric': 'euclidean', 'n_neighbors': 45, 'batch_size': 128}. Best is trial 63 with value: 1.7028500619578684.
/ghome/group07/anaconda3/envs/torch/lib/python3.10/site-packages/torchvision/models/_utils.py:223: UserWarning: Arguments other than a weight enum or `None` for 'weights' are deprecated since 0.13 and may be removed in the future. The current behavior is equivalent to passing `weights=ResNet18_Weights.IMAGENET1K_V1`. You can also use `weights=ResNet18_Weights.DEFAULT` to get the most up-to-date weights.
  warnings.warn(msg)
[I 2024-03-08 18:33:59,232] Trial 85 finished with value: 1.6565055762081784 and parameters: {'knn_metric': 'euclidean', 'n_neighbors': 10, 'batch_size': 128}. Best is trial 63 with value: 1.7028500619578684.
/ghome/group07/anaconda3/envs/torch/lib/python3.10/site-packages/torchvision/models/_utils.py:223: UserWarning: Arguments other than a weight enum or `None` for 'weights' are deprecated since 0.13 and may be removed in the future. The current behavior is equivalent to passing `weights=ResNet18_Weights.IMAGENET1K_V1`. You can also use `weights=ResNet18_Weights.DEFAULT` to get the most up-to-date weights.
  warnings.warn(msg)
[I 2024-03-08 18:34:03,805] Trial 86 finished with value: 1.6736059479553913 and parameters: {'knn_metric': 'euclidean', 'n_neighbors': 18, 'batch_size': 128}. Best is trial 63 with value: 1.7028500619578684.
/ghome/group07/anaconda3/envs/torch/lib/python3.10/site-packages/torchvision/models/_utils.py:223: UserWarning: Arguments other than a weight enum or `None` for 'weights' are deprecated since 0.13 and may be removed in the future. The current behavior is equivalent to passing `weights=ResNet18_Weights.IMAGENET1K_V1`. You can also use `weights=ResNet18_Weights.DEFAULT` to get the most up-to-date weights.
  warnings.warn(msg)
[I 2024-03-08 18:34:08,297] Trial 87 finished with value: 1.6228004956629483 and parameters: {'knn_metric': 'minkowski', 'n_neighbors': 44, 'batch_size': 32}. Best is trial 63 with value: 1.7028500619578684.
/ghome/group07/anaconda3/envs/torch/lib/python3.10/site-packages/torchvision/models/_utils.py:223: UserWarning: Arguments other than a weight enum or `None` for 'weights' are deprecated since 0.13 and may be removed in the future. The current behavior is equivalent to passing `weights=ResNet18_Weights.IMAGENET1K_V1`. You can also use `weights=ResNet18_Weights.DEFAULT` to get the most up-to-date weights.
  warnings.warn(msg)
[I 2024-03-08 18:34:12,942] Trial 88 finished with value: 1.682775712515491 and parameters: {'knn_metric': 'euclidean', 'n_neighbors': 38, 'batch_size': 128}. Best is trial 63 with value: 1.7028500619578684.
/ghome/group07/anaconda3/envs/torch/lib/python3.10/site-packages/torchvision/models/_utils.py:223: UserWarning: Arguments other than a weight enum or `None` for 'weights' are deprecated since 0.13 and may be removed in the future. The current behavior is equivalent to passing `weights=ResNet18_Weights.IMAGENET1K_V1`. You can also use `weights=ResNet18_Weights.DEFAULT` to get the most up-to-date weights.
  warnings.warn(msg)
[I 2024-03-08 18:34:18,354] Trial 89 finished with value: 1.6812887236679057 and parameters: {'knn_metric': 'manhattan', 'n_neighbors': 50, 'batch_size': 128}. Best is trial 63 with value: 1.7028500619578684.
/ghome/group07/anaconda3/envs/torch/lib/python3.10/site-packages/torchvision/models/_utils.py:223: UserWarning: Arguments other than a weight enum or `None` for 'weights' are deprecated since 0.13 and may be removed in the future. The current behavior is equivalent to passing `weights=ResNet18_Weights.IMAGENET1K_V1`. You can also use `weights=ResNet18_Weights.DEFAULT` to get the most up-to-date weights.
  warnings.warn(msg)
[I 2024-03-08 18:34:23,365] Trial 90 finished with value: 1.662205700123915 and parameters: {'knn_metric': 'euclidean', 'n_neighbors': 40, 'batch_size': 128}. Best is trial 63 with value: 1.7028500619578684.
/ghome/group07/anaconda3/envs/torch/lib/python3.10/site-packages/torchvision/models/_utils.py:223: UserWarning: Arguments other than a weight enum or `None` for 'weights' are deprecated since 0.13 and may be removed in the future. The current behavior is equivalent to passing `weights=ResNet18_Weights.IMAGENET1K_V1`. You can also use `weights=ResNet18_Weights.DEFAULT` to get the most up-to-date weights.
  warnings.warn(msg)
[I 2024-03-08 18:34:27,943] Trial 91 finished with value: 1.6877323420074344 and parameters: {'knn_metric': 'euclidean', 'n_neighbors': 45, 'batch_size': 128}. Best is trial 63 with value: 1.7028500619578684.
/ghome/group07/anaconda3/envs/torch/lib/python3.10/site-packages/torchvision/models/_utils.py:223: UserWarning: Arguments other than a weight enum or `None` for 'weights' are deprecated since 0.13 and may be removed in the future. The current behavior is equivalent to passing `weights=ResNet18_Weights.IMAGENET1K_V1`. You can also use `weights=ResNet18_Weights.DEFAULT` to get the most up-to-date weights.
  warnings.warn(msg)
[I 2024-03-08 18:34:32,468] Trial 92 finished with value: 1.681288723667905 and parameters: {'knn_metric': 'euclidean', 'n_neighbors': 42, 'batch_size': 128}. Best is trial 63 with value: 1.7028500619578684.
/ghome/group07/anaconda3/envs/torch/lib/python3.10/site-packages/torchvision/models/_utils.py:223: UserWarning: Arguments other than a weight enum or `None` for 'weights' are deprecated since 0.13 and may be removed in the future. The current behavior is equivalent to passing `weights=ResNet18_Weights.IMAGENET1K_V1`. You can also use `weights=ResNet18_Weights.DEFAULT` to get the most up-to-date weights.
  warnings.warn(msg)
[I 2024-03-08 18:34:36,988] Trial 93 finished with value: 1.6795539033457247 and parameters: {'knn_metric': 'euclidean', 'n_neighbors': 45, 'batch_size': 128}. Best is trial 63 with value: 1.7028500619578684.
/ghome/group07/anaconda3/envs/torch/lib/python3.10/site-packages/torchvision/models/_utils.py:223: UserWarning: Arguments other than a weight enum or `None` for 'weights' are deprecated since 0.13 and may be removed in the future. The current behavior is equivalent to passing `weights=ResNet18_Weights.IMAGENET1K_V1`. You can also use `weights=ResNet18_Weights.DEFAULT` to get the most up-to-date weights.
  warnings.warn(msg)
[I 2024-03-08 18:34:41,457] Trial 94 finished with value: 1.671375464684015 and parameters: {'knn_metric': 'euclidean', 'n_neighbors': 47, 'batch_size': 128}. Best is trial 63 with value: 1.7028500619578684.
/ghome/group07/anaconda3/envs/torch/lib/python3.10/site-packages/torchvision/models/_utils.py:223: UserWarning: Arguments other than a weight enum or `None` for 'weights' are deprecated since 0.13 and may be removed in the future. The current behavior is equivalent to passing `weights=ResNet18_Weights.IMAGENET1K_V1`. You can also use `weights=ResNet18_Weights.DEFAULT` to get the most up-to-date weights.
  warnings.warn(msg)
[I 2024-03-08 18:34:45,909] Trial 95 finished with value: 1.658736059479553 and parameters: {'knn_metric': 'euclidean', 'n_neighbors': 43, 'batch_size': 128}. Best is trial 63 with value: 1.7028500619578684.
/ghome/group07/anaconda3/envs/torch/lib/python3.10/site-packages/torchvision/models/_utils.py:223: UserWarning: Arguments other than a weight enum or `None` for 'weights' are deprecated since 0.13 and may be removed in the future. The current behavior is equivalent to passing `weights=ResNet18_Weights.IMAGENET1K_V1`. You can also use `weights=ResNet18_Weights.DEFAULT` to get the most up-to-date weights.
  warnings.warn(msg)
[I 2024-03-08 18:34:50,918] Trial 96 finished with value: 1.4820322180916983 and parameters: {'knn_metric': 'euclidean', 'n_neighbors': 49, 'batch_size': 8}. Best is trial 63 with value: 1.7028500619578684.
/ghome/group07/anaconda3/envs/torch/lib/python3.10/site-packages/torchvision/models/_utils.py:223: UserWarning: Arguments other than a weight enum or `None` for 'weights' are deprecated since 0.13 and may be removed in the future. The current behavior is equivalent to passing `weights=ResNet18_Weights.IMAGENET1K_V1`. You can also use `weights=ResNet18_Weights.DEFAULT` to get the most up-to-date weights.
  warnings.warn(msg)
[I 2024-03-08 18:34:55,578] Trial 97 finished with value: 1.6698884758364307 and parameters: {'knn_metric': 'minkowski', 'n_neighbors': 45, 'batch_size': 128}. Best is trial 63 with value: 1.7028500619578684.
/ghome/group07/anaconda3/envs/torch/lib/python3.10/site-packages/torchvision/models/_utils.py:223: UserWarning: Arguments other than a weight enum or `None` for 'weights' are deprecated since 0.13 and may be removed in the future. The current behavior is equivalent to passing `weights=ResNet18_Weights.IMAGENET1K_V1`. You can also use `weights=ResNet18_Weights.DEFAULT` to get the most up-to-date weights.
  warnings.warn(msg)
[I 2024-03-08 18:35:00,096] Trial 98 finished with value: 1.6733581164807934 and parameters: {'knn_metric': 'euclidean', 'n_neighbors': 48, 'batch_size': 128}. Best is trial 63 with value: 1.7028500619578684.
/ghome/group07/anaconda3/envs/torch/lib/python3.10/site-packages/torchvision/models/_utils.py:223: UserWarning: Arguments other than a weight enum or `None` for 'weights' are deprecated since 0.13 and may be removed in the future. The current behavior is equivalent to passing `weights=ResNet18_Weights.IMAGENET1K_V1`. You can also use `weights=ResNet18_Weights.DEFAULT` to get the most up-to-date weights.
  warnings.warn(msg)
[I 2024-03-08 18:35:04,626] Trial 99 finished with value: 1.666914498141264 and parameters: {'knn_metric': 'euclidean', 'n_neighbors': 43, 'batch_size': 128}. Best is trial 63 with value: 1.7028500619578684.
